{
  "schemaVersion": "1.0.0",
  "contentVersion": "2026.07.30-v1",
  "hexagramNumber": 31,
  "summaries": [
    {
      "schemaVersion": "1.0.0",
      "contentVersion": "2026.07.30-v1",
      "hexagramNumber": 31,
      "schoolId": "daoist",
      "essence": "Responsive connection grounded in respect gives Influence a path beyond force, passivity, or premature certainty.",
      "summary": "The Daoist lens attends to how force can accord with the configuration instead of contending with it. In Influence, the central situation is mutual influence arising through receptivity, and the commentarial evidence repeatedly emphasizes sensitivity, harmonization, and force. The main danger is manipulation or attraction without durability, especially when partial conditions are mistaken for permission to press ahead. Its constructive capacity is responsive connection grounded in respect, expressed through attention to sequence, relation, and the limits of the present position. Transformation comes through responsive timing: capacity remains available because it is neither suppressed nor spent against the grain.",
      "sourceTensionNote": "The registered sources share the hexagram focus but approach it through different historical, practical, or system-specific scopes; this synthesis preserves that distinction.",
      "evidenceMode": "multi-source-direct",
      "sourcesUsed": [
        {
          "sourceId": "daoist_1_cleary",
          "title": "The Taoist I Ching",
          "contributors": [
            "Liu I-ming",
            "Thomas Cleary (translator)"
          ],
          "contribution": "primary",
          "evidenceMode": "direct",
          "locatorCount": 1,
          "chunkIds": [
            "daoist_1_cleary:hex-31:6b761659e0a1"
          ]
        },
        {
          "sourceId": "daoist_2_wang_bi",
          "title": "The Classic of Changes: A New Translation of the I Ching as Interpreted by Wang Bi",
          "contributors": [
            "Wang Bi",
            "Richard John Lynn (translator)"
          ],
          "contribution": "supporting",
          "evidenceMode": "direct",
          "locatorCount": 1,
          "chunkIds": [
            "daoist_2_wang_bi:hex-31:067e556501d7"
          ]
        }
      ],
      "sentenceSupport": [
        {
          "sentenceIndex": 0,
          "supportingChunkIds": [
            "daoist_1_cleary:hex-31:6b761659e0a1",
            "daoist_2_wang_bi:hex-31:067e556501d7"
          ]
        },
        {
          "sentenceIndex": 1,
          "supportingChunkIds": [
            "daoist_1_cleary:hex-31:6b761659e0a1",
            "daoist_2_wang_bi:hex-31:067e556501d7"
          ]
        },
        {
          "sentenceIndex": 2,
          "supportingChunkIds": [
            "daoist_1_cleary:hex-31:6b761659e0a1",
            "daoist_2_wang_bi:hex-31:067e556501d7"
          ]
        },
        {
          "sentenceIndex": 3,
          "supportingChunkIds": [
            "daoist_1_cleary:hex-31:6b761659e0a1",
            "daoist_2_wang_bi:hex-31:067e556501d7"
          ]
        },
        {
          "sentenceIndex": 4,
          "supportingChunkIds": [
            "daoist_1_cleary:hex-31:6b761659e0a1",
            "daoist_2_wang_bi:hex-31:067e556501d7"
          ]
        }
      ],
      "coverage": {
        "registeredSourceCount": 2,
        "contributingSourceCount": 2,
        "directSourceCount": 2,
        "chunkCount": 2
      },
      "rights": {
        "publicationEligibility": "draft-only",
        "quotationIncluded": false
      },
      "review": {
        "status": "qa-passed",
        "issues": []
      },
      "generation": {
        "generatorKind": "codex-assisted",
        "promptVersion": "school-synthesis-v1",
        "generatedAtIso": "2026-07-30T00:00:00Z",
        "sourceDigest": "ca1c4c0c8c02c22ad702dcb98d957e375a85e8ef4c8da3e39c1ec9e6d8339178"
      }
    },
    {
      "schemaVersion": "1.0.0",
      "contentVersion": "2026.07.30-v1",
      "hexagramNumber": 31,
      "schoolId": "buddhist",
      "essence": "Responsive connection grounded in respect gives Influence a path beyond force, passivity, or premature certainty.",
      "summary": "The Buddhist lens reads the configuration as a discipline of lucid response rather than fixed identity. In Influence, the central situation is mutual influence arising through receptivity, and the commentarial evidence repeatedly emphasizes action, others, and position. The main danger is manipulation or attraction without durability, especially when partial conditions are mistaken for permission to press ahead. Its constructive capacity is responsive connection grounded in respect, expressed through attention to sequence, relation, and the limits of the present position. Transformation rests in meeting conditions without clinging to either resistance or immediate release, so attention can remain compassionate and exact.",
      "evidenceMode": "single-source-direct",
      "sourcesUsed": [
        {
          "sourceId": "buddhist_1_cleary",
          "title": "The Buddhist I Ching",
          "contributors": [
            "Chih-hsu Ou-i",
            "Thomas Cleary (translator)"
          ],
          "contribution": "primary",
          "evidenceMode": "direct",
          "locatorCount": 1,
          "chunkIds": [
            "buddhist_1_cleary:hex-31:8a9286212537"
          ]
        }
      ],
      "sentenceSupport": [
        {
          "sentenceIndex": 0,
          "supportingChunkIds": [
            "buddhist_1_cleary:hex-31:8a9286212537"
          ]
        },
        {
          "sentenceIndex": 1,
          "supportingChunkIds": [
            "buddhist_1_cleary:hex-31:8a9286212537"
          ]
        },
        {
          "sentenceIndex": 2,
          "supportingChunkIds": [
            "buddhist_1_cleary:hex-31:8a9286212537"
          ]
        },
        {
          "sentenceIndex": 3,
          "supportingChunkIds": [
            "buddhist_1_cleary:hex-31:8a9286212537"
          ]
        },
        {
          "sentenceIndex": 4,
          "supportingChunkIds": [
            "buddhist_1_cleary:hex-31:8a9286212537"
          ]
        }
      ],
      "coverage": {
        "registeredSourceCount": 1,
        "contributingSourceCount": 1,
        "directSourceCount": 1,
        "chunkCount": 1
      },
      "rights": {
        "publicationEligibility": "draft-only",
        "quotationIncluded": false
      },
      "review": {
        "status": "qa-passed",
        "issues": []
      },
      "generation": {
        "generatorKind": "codex-assisted",
        "promptVersion": "school-synthesis-v1",
        "generatedAtIso": "2026-07-30T00:00:00Z",
        "sourceDigest": "ab9ba0720d5744207995380773ba24787eac2af4e3b58696269319cab27bc5de"
      }
    },
    {
      "schemaVersion": "1.0.0",
      "contentVersion": "2026.07.30-v1",
      "hexagramNumber": 31,
      "schoolId": "confucian",
      "essence": "Responsive connection grounded in respect gives Influence a path beyond force, passivity, or premature certainty.",
      "summary": "The Confucian lens places the configuration within cultivated conduct, position, and responsibility. In Influence, the central situation is mutual influence arising through receptivity, and the commentarial evidence repeatedly emphasizes sensitivity, beneficial, and success. The main danger is manipulation or attraction without durability, especially when partial conditions are mistaken for permission to press ahead. Its constructive capacity is responsive connection grounded in respect, expressed through attention to sequence, relation, and the limits of the present position. Development therefore joins inward steadiness with outward appropriateness, making character visible through conduct suited to the moment.",
      "sourceTensionNote": "The registered sources share the hexagram focus but approach it through different historical, practical, or system-specific scopes; this synthesis preserves that distinction.",
      "evidenceMode": "multi-source-direct",
      "sourcesUsed": [
        {
          "sourceId": "confucian_1_cleary",
          "title": "I Ching: The Book of Change",
          "contributors": [
            "Thomas Cleary (translator)"
          ],
          "contribution": "primary",
          "evidenceMode": "direct",
          "locatorCount": 1,
          "chunkIds": [
            "confucian_1_cleary:hex-31:ae19b3295984"
          ]
        },
        {
          "sourceId": "confucian_2_legge",
          "title": "I Ching: The Book of Changes",
          "contributors": [
            "James Legge (translator)"
          ],
          "contribution": "supporting",
          "evidenceMode": "direct",
          "locatorCount": 1,
          "chunkIds": [
            "confucian_2_legge:hex-31:000840e2c5dd"
          ]
        }
      ],
      "sentenceSupport": [
        {
          "sentenceIndex": 0,
          "supportingChunkIds": [
            "confucian_1_cleary:hex-31:ae19b3295984",
            "confucian_2_legge:hex-31:000840e2c5dd"
          ]
        },
        {
          "sentenceIndex": 1,
          "supportingChunkIds": [
            "confucian_1_cleary:hex-31:ae19b3295984",
            "confucian_2_legge:hex-31:000840e2c5dd"
          ]
        },
        {
          "sentenceIndex": 2,
          "supportingChunkIds": [
            "confucian_1_cleary:hex-31:ae19b3295984",
            "confucian_2_legge:hex-31:000840e2c5dd"
          ]
        },
        {
          "sentenceIndex": 3,
          "supportingChunkIds": [
            "confucian_1_cleary:hex-31:ae19b3295984",
            "confucian_2_legge:hex-31:000840e2c5dd"
          ]
        },
        {
          "sentenceIndex": 4,
          "supportingChunkIds": [
            "confucian_1_cleary:hex-31:ae19b3295984",
            "confucian_2_legge:hex-31:000840e2c5dd"
          ]
        }
      ],
      "coverage": {
        "registeredSourceCount": 2,